{
  "$schema": "../schema/codecs.schema.json",
  "group": "basics",
  "note": "Primitive types, an alias, an enum and a struct.",
  "types": {
    "MessageId": {
      "alias": "uuid"
    },
    "SendError": {
      "enum": {
        "variants": [
          {
            "name": "RoomNotFound"
          },
          {
            "name": "TooLong",
            "type": {
              "struct": {
                "fields": [
                  {
                    "name": "max",
                    "type": "u32"
                  }
                ]
              }
            }
          }
        ]
      }
    },
    "Message": {
      "struct": {
        "fields": [
          {
            "name": "id",
            "type": {
              "ref": "MessageId"
            }
          },
          {
            "name": "author",
            "type": "string"
          },
          {
            "name": "text",
            "type": "string"
          },
          {
            "name": "sent_at",
            "type": "timestamp"
          }
        ]
      }
    }
  },
  "cases": [
    {
      "id": "u64-max",
      "spec": [
        "12.3"
      ],
      "note": "Largest u64. cbor: 8-byte unsigned integer. json: a decimal string, to avoid JavaScript precision loss.",
      "type": "u64",
      "direction": "both",
      "value": "18446744073709551615",
      "cbor": "1b ff ff ff ff ff ff ff ff",
      "json": "\"18446744073709551615\""
    },
    {
      "id": "timestamp-millis",
      "spec": [
        "12.3"
      ],
      "note": "A timestamp with milliseconds. cbor: tag 1 with the shortest float that keeps millisecond precision (float64 here). json: RFC 3339 in UTC with milliseconds.",
      "type": "timestamp",
      "direction": "both",
      "value": "1(1758499200.123)",
      "cbor": "c1 fb 41 da 34 24 60 07 df 3b",
      "json": "\"2025-09-22T00:00:00.123Z\""
    },
    {
      "id": "uuid-tag-37",
      "spec": [
        "12.3"
      ],
      "note": "uuid through an alias. cbor: tag 37 over a 16-byte byte string. json: lowercase hyphenated text.",
      "type": {
        "ref": "MessageId"
      },
      "direction": "both",
      "value": "37(h'7d4448409dc011d1b2455ffdce74fad2')",
      "cbor": "d8 25 50 7d 44 48 40 9d c0 11 d1 b2 45 5f fd ce 74 fa d2",
      "json": "\"7d444840-9dc0-11d1-b245-5ffdce74fad2\""
    },
    {
      "id": "bytes-base64url",
      "spec": [
        "12.3"
      ],
      "note": "bytes. json: base64url without padding; the value is chosen so that standard base64 would differ ('-' and '_').",
      "type": "bytes",
      "direction": "both",
      "value": "h'fbff0001'",
      "cbor": "44 fb ff 00 01",
      "json": "\"-_8AAQ\""
    },
    {
      "id": "bytes-padded-json",
      "spec": [
        "12.3"
      ],
      "note": "Padded base64url input: json decoders reject it.",
      "type": "bytes",
      "direction": "decode",
      "error": {
        "codec": "json",
        "reason": "padded base64url"
      },
      "json": "\"-_8AAQ==\""
    },
    {
      "id": "enum-data-variant",
      "spec": [
        "12.3"
      ],
      "note": "A data enum variant is a single-entry map keyed by the variant name.",
      "type": {
        "ref": "SendError"
      },
      "direction": "both",
      "value": "{\"TooLong\": {\"max\": 2000}}",
      "cbor": "a1 67 54 6f 6f 4c 6f 6e 67 a1 63 6d 61 78 19 07 d0",
      "json": "{\"TooLong\":{\"max\":2000}}"
    },
    {
      "id": "struct-message",
      "spec": [
        "12.3",
        "Appendix A"
      ],
      "note": "A struct is a map keyed by field names, encoded in manifest declaration order (draft 0.9). Decoders accept any order.",
      "type": {
        "ref": "Message"
      },
      "direction": "both",
      "value": "{\"id\": 37(h'7d4448409dc011d1b2455ffdce74fad2'), \"author\": \"ana\", \"text\": \"hi\", \"sent_at\": 1(1758499200)}",
      "cbor": "a4 62 69 64 d8 25 50 7d 44 48 40 9d c0 11 d1 b2 45 5f fd ce 74 fa d2 66 61 75 74 68 6f 72 63 61 6e 61 64 74 65 78 74 62 68 69 67 73 65 6e 74 5f 61 74 c1 1a 68 d0 91 80",
      "json": "{\"id\":\"7d444840-9dc0-11d1-b245-5ffdce74fad2\",\"author\":\"ana\",\"text\":\"hi\",\"sent_at\":\"2025-09-22T00:00:00.000Z\"}"
    },
    {
      "id": "f64-half-width",
      "spec": [
        "12.3"
      ],
      "note": "1.5 is exact in half precision, so the encoder emits the 2-byte form (draft 0.9: shortest width that represents the value exactly).",
      "type": "f64",
      "direction": "both",
      "value": "1.5",
      "cbor": "f9 3e 00",
      "json": "1.5"
    },
    {
      "id": "f64-single-width",
      "spec": [
        "12.3"
      ],
      "note": "100000.0 exceeds the half-precision range but is exact in single precision.",
      "type": "f64",
      "direction": "both",
      "value": "100000.0",
      "cbor": "fa 47 c3 50 00",
      "json": "100000"
    },
    {
      "id": "f64-double-width",
      "spec": [
        "12.3"
      ],
      "note": "0.1 is exact only in double precision. The json number follows RFC 8785.",
      "type": "f64",
      "direction": "both",
      "value": "0.1",
      "cbor": "fb 3f b9 99 99 99 99 99 9a",
      "json": "0.1"
    },
    {
      "id": "map-sorted-keys",
      "spec": [
        "12.3"
      ],
      "note": "map keys sorted per codec: cbor by the bytewise order of the encoded keys (shorter text sorts first, so \"b\" precedes \"aa\"), json by the bytewise order of the UTF-8 keys (\"aa\" precedes \"b\").",
      "type": {
        "map": "u32"
      },
      "direction": "both",
      "value": "{\"a\": 1, \"b\": 2, \"aa\": 3}",
      "cbor": "a3 61 61 01 61 62 02 62 61 61 03",
      "json": "{\"a\":1,\"aa\":3,\"b\":2}"
    },
    {
      "id": "map-unsorted-input",
      "spec": [
        "12.3"
      ],
      "note": "The same map with keys out of order: decoders accept it, encoders never produce it.",
      "type": {
        "map": "u32"
      },
      "direction": "decode",
      "value": "{\"a\": 1, \"b\": 2, \"aa\": 3}",
      "cbor": "a3 62 61 61 03 61 62 02 61 61 01"
    },
    {
      "id": "struct-message-fields-out-of-order",
      "spec": [
        "12.3"
      ],
      "note": "The struct-message value with its fields in a different order (author, text, sent_at, id): decoders accept it, encoders never produce it.",
      "type": {
        "ref": "Message"
      },
      "direction": "decode",
      "value": "{\"id\": 37(h'7d4448409dc011d1b2455ffdce74fad2'), \"author\": \"ana\", \"text\": \"hi\", \"sent_at\": 1(1758499200)}",
      "cbor": "a4 66 61 75 74 68 6f 72 63 61 6e 61 64 74 65 78 74 62 68 69 67 73 65 6e 74 5f 61 74 c1 1a 68 d0 91 80 62 69 64 d8 25 50 7d 44 48 40 9d c0 11 d1 b2 45 5f fd ce 74 fa d2"
    },
    {
      "id": "f32-half-width",
      "spec": [
        "12.3"
      ],
      "note": "An f32 value exact in half precision is emitted in the 2-byte form, like f64.",
      "type": "f32",
      "direction": "both",
      "value": "0.5",
      "cbor": "f9 38 00",
      "json": "0.5"
    },
    {
      "id": "f32-single-width",
      "spec": [
        "12.3"
      ],
      "note": "The largest finite f32: outside the half-precision range, exact in single precision. An f32 never needs the double width. The json number follows RFC 8785.",
      "type": "f32",
      "direction": "both",
      "value": "3.4028234663852886e+38",
      "cbor": "fa 7f 7f ff ff",
      "json": "3.4028234663852886e+38"
    },
    {
      "id": "string-rfc8785-escapes",
      "spec": [
        "12.3"
      ],
      "note": "json strings follow RFC 8785 3.2.2: quote, backslash and newline use their short escapes, other control characters use lowercase \\u00xx, and non-ASCII characters (an accented letter and an emoji) stay as raw UTF-8. cbor carries the same text unchanged.",
      "type": "string",
      "direction": "both",
      "value": "\"a\\\"b\\\\c\\nd\\u0001é😀\"",
      "cbor": "6e 61 22 62 5c 63 0a 64 01 c3 a9 f0 9f 98 80",
      "json": "\"a\\\"b\\\\c\\nd\\u0001é😀\""
    }
  ]
}
